{
  "schema_version": "za3im.execution.result/0.1",
  "execution_id": "exec-example-synthetic-001",
  "status": "succeeded",
  "started_at": "2026-10-10T14:00:00Z",
  "finished_at": "2026-10-10T14:00:04Z",
  "summary": "Synthetic schema fixture only. No real provider call occurred.",
  "artifacts": [
    {
      "artifact_id": "artifact-example-html",
      "role": "website_html",
      "media_type": "text/html; charset=utf-8",
      "sha256": "0000000000000000000000000000000000000000000000000000000000000000",
      "size_bytes": 1024,
      "provenance_reference_ids": []
    }
  ],
  "verification": {
    "status": "passed",
    "checks": [
      {
        "check_id": "example-shape-only",
        "status": "passed",
        "method": "schema",
        "evidence_reference_ids": ["event-example-1"],
        "details": "Synthetic fixture; not a claim that this artifact exists remotely."
      }
    ]
  },
  "accounting": {
    "actual_provider_cost_usd": null,
    "estimated_provider_cost_usd": 0.0001,
    "customer_credits_charged": null,
    "accounting_status": "estimated",
    "usage_reference_ids": ["event-example-usage"]
  },
  "engine": {
    "engine_id": "fake-provider-test-double",
    "engine_version": "synthetic",
    "adapter_version": "0.1.0",
    "model_provider": "synthetic",
    "model_id": "synthetic-only"
  },
  "errors": [],
  "side_effects": [],
  "event_reference_ids": ["event-example-1", "event-example-usage"],
  "known_limitations": ["Synthetic example only; it is not a live-provider specimen and does not prove deployment, billing or production readiness."]
}
